{
  "schemaVersion": 4,
  "datasetVersion": "2026.07.02.1",
  "generatedAt": "2026-07-02T00:00:00Z",
  "tool": {
    "name": "erroratlas",
    "version": "0.6.0"
  },
  "license": "CC-BY-4.0",
  "privacy": {
    "scope": "allow-listed public repositories; aggregate metrics and public provenance only",
    "excluded": [
      "source code",
      "raw repository file paths",
      "raw error messages",
      "raw error identities",
      "raw error codes",
      "raw scan payloads",
      "raw findings",
      "stack traces",
      "secrets",
      "tokens",
      "private repository metadata"
    ]
  },
  "summary": {
    "repositoryCount": 11,
    "ecosystemCount": 7,
    "filesScanned": 335,
    "filesByLanguage": {
      "csharp": 32,
      "go": 17,
      "java": 4,
      "javascript": 4,
      "kotlin": 43,
      "python": 146,
      "typescript": 107
    },
    "filesByEcosystem": {
      "csharp": 32,
      "go": 16,
      "java": 3,
      "kotlin": 27,
      "python": 146,
      "typescript-javascript": 111
    },
    "occurrenceCount": 36,
    "structuredOccurrences": 0,
    "unstructuredOccurrences": 36,
    "structuredRatio": 0,
    "codeDensity": 0.1075,
    "uniqueStructuredIdentities": 0,
    "documentedStructuredIdentities": 0,
    "documentationCoverage": null,
    "openapiDocumentCount": 1,
    "openapiDriftCount": null,
    "problemDetailsOccurrences": 0,
    "problemDetailsCoverage": null,
    "baselineDebtCount": null,
    "netNewDriftCount": null,
    "confidenceDistribution": {
      "partial": 0,
      "proven": 0,
      "unresolved": 36
    },
    "apiResponseOccurrences": 0,
    "scanDurationMs": 233,
    "failureCount": 0,
    "skipCount": 0,
    "categories": {
      "csharp-aspnet": 1,
      "go-http": 1,
      "java-spring": 1,
      "javascript-fastify": 1,
      "kotlin-ktor": 1,
      "openapi-spec": 1,
      "python-drf": 1,
      "python-fastapi": 1,
      "typescript-express": 1,
      "typescript-nestjs": 1,
      "typescript-next": 1
    },
    "ecosystems": {
      "csharp": 1,
      "go": 1,
      "java": 1,
      "kotlin": 1,
      "openapi": 1,
      "python": 2,
      "typescript-javascript": 4
    },
    "statusFamilies": {},
    "extractorLimitations": {
      "no-error-occurrences-detected": 3,
      "unstructured-errors-present": 8
    },
    "unsupportedPatternCategories": {
      "unstructured-error": 36
    },
    "limitations": {
      "baseline-not-evaluated": 11,
      "catalog-not-present": 11,
      "openapi-drift-not-evaluated": 1,
      "openapi-not-present": 10,
      "source-scan-not-configured": 1
    },
    "perEcosystem": {
      "csharp": {
        "repositories": 1,
        "filesScanned": 32,
        "occurrenceCount": 3,
        "structuredOccurrences": 0,
        "unstructuredOccurrences": 3
      },
      "go": {
        "repositories": 1,
        "filesScanned": 16,
        "occurrenceCount": 9,
        "structuredOccurrences": 0,
        "unstructuredOccurrences": 9
      },
      "java": {
        "repositories": 1,
        "filesScanned": 3,
        "occurrenceCount": 0,
        "structuredOccurrences": 0,
        "unstructuredOccurrences": 0
      },
      "kotlin": {
        "repositories": 1,
        "filesScanned": 27,
        "occurrenceCount": 4,
        "structuredOccurrences": 0,
        "unstructuredOccurrences": 4
      },
      "openapi": {
        "repositories": 1,
        "filesScanned": 0,
        "occurrenceCount": 0,
        "structuredOccurrences": 0,
        "unstructuredOccurrences": 0
      },
      "python": {
        "repositories": 2,
        "filesScanned": 146,
        "occurrenceCount": 7,
        "structuredOccurrences": 0,
        "unstructuredOccurrences": 7
      },
      "typescript-javascript": {
        "repositories": 4,
        "filesScanned": 111,
        "occurrenceCount": 13,
        "structuredOccurrences": 0,
        "unstructuredOccurrences": 13
      }
    }
  },
  "repositories": [
    {
      "id": "express-typescript-boilerplate",
      "name": "express-typescript-boilerplate",
      "owner": "w3tecch",
      "repo": "express-typescript-boilerplate",
      "url": "https://github.com/w3tecch/express-typescript-boilerplate",
      "host": "github.com",
      "commit": "17727010f7f098d8ca8b78da0a5b3c7297659381",
      "defaultBranch": "develop",
      "ecosystem": "typescript-javascript",
      "primaryLanguage": "typescript",
      "category": "typescript-express",
      "framework": "Express",
      "reason": "Existing v0.6.0 external target representing TypeScript/Express API service structure.",
      "expectedLimitations": [
        "custom-error-taxonomy-may-remain-partial",
        "no-committed-erroratlas-catalog"
      ],
      "archived": false,
      "scannedAt": "2026-07-02T00:00:00Z",
      "status": "scanned",
      "licenseEvidence": {
        "spdxId": "MIT",
        "name": "MIT License",
        "licenseFile": "LICENSE",
        "metadataSource": "github-api",
        "url": "https://github.com/w3tecch/express-typescript-boilerplate/blob/17727010f7f098d8ca8b78da0a5b3c7297659381/LICENSE",
        "sha256": "e119e5c7536e0b1a8ec6e3f5b41b799817a02e008419309522c215b3c953712a"
      },
      "metrics": {
        "filesScanned": 59,
        "filesByLanguage": {
          "typescript": 59
        },
        "filesByEcosystem": {
          "typescript-javascript": 59
        },
        "occurrenceCount": 3,
        "structuredOccurrences": 0,
        "unstructuredOccurrences": 3,
        "structuredRatio": 0,
        "codeDensity": 0.0508,
        "uniqueStructuredIdentities": 0,
        "documentedStructuredIdentities": 0,
        "documentationCoverage": null,
        "openapiDocumentCount": 0,
        "openapiDriftCount": null,
        "problemDetailsOccurrences": 0,
        "problemDetailsCoverage": null,
        "baselineDebtCount": null,
        "netNewDriftCount": null,
        "confidenceDistribution": {
          "proven": 0,
          "partial": 0,
          "unresolved": 3
        },
        "apiResponseOccurrences": 0,
        "scanDurationMs": 83,
        "statusFamilies": {},
        "extractorLimitations": {
          "unstructured-errors-present": 1
        },
        "unsupportedPatternCategories": {
          "unstructured-error": 3
        },
        "limitations": {
          "baseline-not-evaluated": 1,
          "openapi-not-present": 1,
          "catalog-not-present": 1
        }
      }
    },
    {
      "id": "fastify-example",
      "name": "example",
      "owner": "fastify",
      "repo": "example",
      "url": "https://github.com/fastify/example",
      "host": "github.com",
      "commit": "30c7870a4aa448ff7839e0bd99630071ecb5b510",
      "defaultBranch": "main",
      "ecosystem": "typescript-javascript",
      "primaryLanguage": "javascript",
      "category": "javascript-fastify",
      "framework": "Fastify",
      "reason": "Small official Fastify example corpus with JavaScript and TypeScript examples.",
      "expectedLimitations": [
        "example-app-patterns-may-not-encode-machine-readable-error-identities",
        "no-committed-erroratlas-catalog"
      ],
      "archived": false,
      "scannedAt": "2026-07-02T00:00:00Z",
      "status": "scanned",
      "licenseEvidence": {
        "spdxId": "MIT",
        "name": "MIT License",
        "licenseFile": "LICENSE",
        "metadataSource": "github-api",
        "url": "https://github.com/fastify/example/blob/30c7870a4aa448ff7839e0bd99630071ecb5b510/LICENSE",
        "sha256": "ba9677e5a34c2738c26b36bb478f95e0369cac48fbe68a01a91fd5c7972f2043"
      },
      "metrics": {
        "filesScanned": 7,
        "filesByLanguage": {
          "javascript": 4,
          "typescript": 3
        },
        "filesByEcosystem": {
          "typescript-javascript": 7
        },
        "occurrenceCount": 0,
        "structuredOccurrences": 0,
        "unstructuredOccurrences": 0,
        "structuredRatio": null,
        "codeDensity": 0,
        "uniqueStructuredIdentities": 0,
        "documentedStructuredIdentities": 0,
        "documentationCoverage": null,
        "openapiDocumentCount": 0,
        "openapiDriftCount": null,
        "problemDetailsOccurrences": 0,
        "problemDetailsCoverage": null,
        "baselineDebtCount": null,
        "netNewDriftCount": null,
        "confidenceDistribution": {
          "proven": 0,
          "partial": 0,
          "unresolved": 0
        },
        "apiResponseOccurrences": 0,
        "scanDurationMs": 9,
        "statusFamilies": {},
        "extractorLimitations": {
          "no-error-occurrences-detected": 1
        },
        "unsupportedPatternCategories": {},
        "limitations": {
          "baseline-not-evaluated": 1,
          "openapi-not-present": 1,
          "catalog-not-present": 1
        }
      }
    },
    {
      "id": "nextjs-vat-validation",
      "name": "nextjs-vat-validation",
      "owner": "eurovalidate",
      "repo": "nextjs-vat-validation",
      "url": "https://github.com/eurovalidate/nextjs-vat-validation",
      "host": "github.com",
      "commit": "5a419066c504653c478684bc1863e7b71843fae4",
      "defaultBranch": "main",
      "ecosystem": "typescript-javascript",
      "primaryLanguage": "typescript",
      "category": "typescript-next",
      "framework": "Next.js",
      "reason": "Small App Router API-route example for Next.js response-surface validation.",
      "expectedLimitations": [
        "small-example-repository",
        "no-committed-erroratlas-catalog"
      ],
      "archived": false,
      "scannedAt": "2026-07-02T00:00:00Z",
      "status": "scanned",
      "licenseEvidence": {
        "spdxId": "MIT",
        "name": "MIT License",
        "licenseFile": "LICENSE",
        "metadataSource": "github-api",
        "url": "https://github.com/eurovalidate/nextjs-vat-validation/blob/5a419066c504653c478684bc1863e7b71843fae4/LICENSE",